<?xml version="1.0" encoding="utf-8"?>
<!--
 FATTYCURD MENU CONFIG
 
 Resolution can be either absolute or relative if absolute then if the user
 change resolution the objects will be missplaces! Relative positionning and
 size express in part of fullscreen resolution
 
 0.0, 0.0        0.0, 1.0
 screen
 1.0, 0.0        1.0, 1.0
 
 Don't forget in case you use relative positionning to also specify the size
 or it won't be correct!
 
 FAQ
 [Position] express the position of the CENTER of the object!
 [timeout] floating value in second
 [set-value] is a value that is send to the game engine
 [linked-to] this value is linked to a value in the game engine
 -->
<sub-menu
	xmlns:xsi="http://www.w3.org/2001/XMLSchema-instance"
	xsi:noNamespaceSchemaLocation="fattycurd-sub-menu.xsd">
	<still-state name="title" goto-state="game" timeout="10.0">

		<set-value linked-to="fattycurd.camera" value="fixed"/>
				
        <image coordinate="relative">
            <position hpos="0.5" vpos="0.5"/>
            <size height="1.0" width="1.2"/>
            <location>Images/Title_ScreenBG.jpg</location>
        </image>
		
        <image coordinate="relative">
			<position hpos="0.5" vpos="0.5"/>
			<size height="0.4" width="0.8"/>
			<location>Images/title.png</location>
		</image>
	</still-state>
</sub-menu>

